[
  {
    "id": "faq-001",
    "question": "服部半藏发动隐匿后不视为军团，此时翻开诸神黄昏天灾，会被置入墓地吗？",
    "answer": "会，天灾机制无法被规避。",
    "relatedCardIds": [],
    "keywords": [],
    "source": "Q&A.docx"
  },
  {
    "id": "faq-002",
    "question": "我方汉尼拔活跃在前排，此时天灾为暴怒之罪，对方可以进攻汉尼拔吗？",
    "answer": "不可以，暴怒之罪效果为进攻时必须优先选择进攻范围内的对方军团作为进攻目标，而汉尼拔处于活跃时不可被进攻，并非合理的进攻目标。",
    "relatedCardIds": [],
    "keywords": [],
    "source": "Q&A.docx"
  },
  {
    "id": "faq-003",
    "question": "伊西斯弃置战场上三张陵墓守卫将墓地的【卡诺匹斯】系列圣物置入圣物区，回合结束会再度弃置吗？",
    "answer": "不会，“置入”有别于“登场”，置入圣物区并不会发动登场时效果，也就是说不会结算登场效果中的“弃置此圣物”效果。",
    "relatedCardIds": [],
    "keywords": [],
    "source": "Q&A.docx"
  },
  {
    "id": "faq-004",
    "question": "彼界试炼卡完成时的“触发”效果可以使用绝对防御响应吗？",
    "answer": "可以。",
    "relatedCardIds": [],
    "keywords": [],
    "source": "Q&A.docx"
  },
  {
    "id": "faq-005",
    "question": "彼界试炼卡湖中仙女的馈赠的“持续”效果我方已叠放<王者之剑>的<亚瑟王>即将阵亡时，移除<王者之剑>：代替承受本次致命进攻或效果。此效果可以被响应吗？",
    "answer": "前者的“持续”是指赋予我方已叠放<王者之剑>的<亚瑟王>用剑代替承受致命进攻或效果，这个常驻效果本身是无法被响应无效的。而后者则属于触发式效果，那么代表此效果在触发时，是可以被响应无效的。",
    "relatedCardIds": [],
    "keywords": [],
    "source": "Q&A.docx"
  },
  {
    "id": "faq-006",
    "question": "落穴陷阱能否无效军团所有登场效果？例如晋升登场的赫拉克勒斯。",
    "answer": "不能，赫拉克勒斯晋升的 [晋升登场]和[登场时]是分段的，落穴只能无效其中的一个登场效果。",
    "relatedCardIds": [],
    "keywords": [],
    "source": "Q&A.docx"
  },
  {
    "id": "faq-007",
    "question": "源义经在后排进攻时视为2000兵力，能和月读效果自排顺序，先视为2000兵力，再触发月读的效果增加兵力吗？",
    "answer": "可以。",
    "relatedCardIds": [],
    "keywords": [],
    "source": "Q&A.docx"
  },
  {
    "id": "faq-008",
    "question": "我方回合先打出黑莲花，再登场托勒密十三世再次发动黑莲花，如何结算？",
    "answer": "只能发动黑莲花的第一段效果，需要消耗士气的第二段效果无法发动。",
    "relatedCardIds": [],
    "keywords": [],
    "source": "Q&A.docx"
  },
  {
    "id": "faq-009",
    "question": "彼界阵营的“发动试炼”如何理解？",
    "answer": "指将该试炼军团休整（横置）并以该军团卡牌右侧标注的试炼数值推进试炼进度，规则书有相关描述。无法被响应，且发动试炼与发动进攻一样，同样享有登场失调。\n关于响应时点\n根据新规则书，分为了持续效果、主动式效果、触发式效果、反应式效果，故原本一些以逗号区分时点和被动的判定有所调整。\n接下来依旧以QA形式把之前的一些案例进行说明：",
    "relatedCardIds": [],
    "keywords": [],
    "source": "Q&A.docx"
  },
  {
    "id": "faq-010",
    "question": "原本吕布进攻后返还士气转为活跃的效果是无法被响应的，因为是逗号，现在是否可以被响应？",
    "answer": "是的，但注意吕布的进攻后返还4士气为效果并非cost，所以即便使用绝对防御进行响应，吕布无法转为活跃，但士气不用返还。",
    "relatedCardIds": [],
    "keywords": [],
    "source": "Q&A.docx"
  },
  {
    "id": "faq-011",
    "question": "原本月读的效果从后排位移至前排时，是作为被动，不会受到傲慢之罪的影响，现在是否会被影响？",
    "answer": "是的，它属于触发式效果。",
    "relatedCardIds": [],
    "keywords": [],
    "source": "Q&A.docx"
  },
  {
    "id": "faq-012",
    "question": "孙悟空回合结束时返回主宰区可以被绝对防御吗？",
    "answer": "可以被绝对防御，此时孙悟空会以X兵力（X=当时返还的士气*1000）保留在战场上。孙悟空视为军团在战场上时，因主宰区没有主宰，所以无法被进攻，但作为军团的孙悟空被进攻时，不会视为进攻主宰，而是视为进行了军团的战斗交互。此QA衍生出下面一条↓",
    "relatedCardIds": [],
    "keywords": [],
    "source": "Q&A.docx"
  },
  {
    "id": "faq-013",
    "question": "孙悟空离场时会返回主宰区吗？",
    "answer": "是的。作为军团的主宰以任何方式离场皆会返回主宰区。",
    "relatedCardIds": [],
    "keywords": [],
    "source": "Q&A.docx"
  },
  {
    "id": "faq-014",
    "question": "虚构的圣杯在场时，安德华拉诺特的“对方回合，我方主宰受到的第一次伤害变为2”规则书写是触发式效果？",
    "answer": "这条是对规则书的QA进行QA，此处为持续效果，判定结果不变，不算“使用”，【非持续效果都算使用】不会变成掉3血，而发动我方主宰受到伤害时，可抽取1张牌的效果则是会受到虚构圣杯影响额外掉血。\n部分勘误：\n腐秽大地在场时，我方军团可以位移至后排吗？\n[持续]效果应改为：军团无法放置和位移至后排。打出<反击战术>无需消耗费用。\n李牧：“我方士气因主宰效果返还4张及以上时”改为“我方士气因主宰返还4张及以上时”。返还4张士气为cost，而不是效果。\n哮天犬·稚：“我方士气因主宰效果返还4张及以上时”改为“我方士气因主宰返还4张及以上时”。\n密米尔之泉：“若本回合我方主宰因效果受到累计2点及更多伤害”改为“若本回合我方主宰受到累计2点及更多伤害”。",
    "relatedCardIds": [],
    "keywords": [],
    "source": "Q&A.docx"
  }
]